;Required skill
1584;организовывает процесс подбора компаний-партеров для выполнения работ по проектированию и строительству участвует в заключении договоров подряда следит за выполнением подрядными организациями договорных обязательств
1585;опыт работы руководителем проекта
1586;опыт работы в руководящей должности (директор по строительству заместитель директора по строительству)
1587;знание строительных процессов
1588;опыт работы в службе заказчика обязателен
1589;отличное владение компьютером: приложения ms office (excel – опытный пользователь) autocad/archicad
1590;высшее образование (профильное)
1591;опыт работы от 2-х лет (в проектных организациях)
1592;подготовка и разработка чертежей пос
1593;знание программ ms office autocad revit (как преимущество)
1594;умение работать самостоятельно и в команде аккуратность внимательность
1595;руководство деятельностью отдела 
1596;организация производственно-технического обеспечения смр на строящихся объектах 
1597;работа с проектно-сметной документацией 
1598;организация процесса проверки объемов выполненных работ на объектах 
1599;организация процесса составления годового квартального месячного плана выполненных объемов работ и бюджета расходов по объектам контроль соблюдения его выполнения 
1600;ведение деловых переговоров и деловой переписки 
1601;высшее профессиональное (техническое) образование 
1602;опыт работы в должности начальника производственно-технического отдела (приоритетно) 
1603;наличие прикладных знаний нормативно-технической документации в строительстве планировании и финансировании деятельности 
1604;знание правил промышленной пожарной экологической безопасности нормативно правовых актов в области охраны труда 
1605;опытный пользователь ms office (excel word outlook power point) 
1606;руководство полным циклом реализации проекта
1607;общее управление ходом реализации проекта
1608;планирование контроль и согласование всех административных вопросов на стадиях выполнения проекта с момента его открытия до момента окончания
1609;планирование и контроль исполнения бюджетов проектов
1610;планирование и контроль использования ресурсов проектов
1611;контроль исполнения сроков проектов
1612;управление рисками проектов
1613;отслеживание технических и временных взаимосвязей с другими проектами
1614;обеспечение взаимодействия всех организаций (партнеров профильных подразделений подрядчиков и тд) в ходе реализации проектов
1615;подготовка регулярной отчетности по проектным задачам
1616;участие в исполнительных и управляющих комитетах и подготовке презентаций к ним
1617;управление удаленными проектами
1618;управление подрядчиками (контроль сроков исполнения работ бюджетов объемов выполняемых работ)
1619;высшее строительное образование (желательно пгс)
1620;опыт работы не менее 5 лет
1621;глубокие знания проектных методологий на основе стандарта рmbok
1622;знание на уровне уверенного пользователя ms office ms visio ms project
1623;опыт управления строительными проектами
1624;высшим образованием
1625;опытом работы в области продаж от 2-х лет (продажа промышленного оборудования проектные продажи в2в)
1626;превосходными коммуникативными навыками грамотной устной и письменной речью мобильностью
1627;умением вести предварительную работу по подготовке и оформлениюдоговоров и коммерческих предложений презентаций
1628;умением выстраивать долгосрочные отношения с клиентами компании
1629;ориентированностью на положительный результат и эффективную работу ответственностью
1630;организация строительства и реконструкции объектов 
1631;работа с первичной документацией 
1632;анализ текущего состояния объекта строительства 
1633;формирование управленческой отчетности 
1634;курирование процедур по рассмотрению согласованию проектной и сопутствующей документации опыт работы с подрядными организациями техническим и авторским надзором 
1635;планирование и курирование деятельности подрядных организаций 
1636;ведение деловой переписки 
1637;высшее профессиональное (пгс/ техническое) образование 
1638;опыт работы в должности инженера пто/сдо (приветствуется) 
1639;наличие прикладных знаний нормативно-технической документации в строительстве планировании и финансировании деятельности 
1640;знание основ сметного дела 
1641;знание основ бухгалтерского и налогового учета пхд 
1642;опытный пользователь ms office (excel word outlook power point) autocad грандсмета 
1643;осуществление взаимодействия с контрагентами управлениями общества при оформлении договоров
1644;подготовка технических заданий для проведения конкурсных процедур по определению подрядчиков на выполнение работ
1645;осуществление контроля за разработкой проектно-сметной документации получением исходно-разрешительной документации прохождением экспертизы оформлением разрешительной документации на право производства работ выполнением строительно-монтажных работ
1646;контроль ведения работ приемка выполненных работ/проверка объемов и исполнительной документации
1647;контроль за вводом объектов в эксплуатацию в установленные сроки
1648;высшее техническое образование
1649;релевантный опыт работы от 3-х лет
1650;опыт работы в структурах генподрядчика/технического заказчика
1651;уверенный пользователь пк
1652;ответственность стрессоустойчивость аналитический склад ума умение работать в режиме многозадачности
1653;осуществление контроля за ходом строительства реконструкции объектов нового строительства и их соответствия требованиям технических регламентов утвержденной проектной документации рабочим чертежам строительным нормам применяемыми строительными материалами
1654;фиксирование и оформление нарушений выявленных в результате проведения проверок доведение их до заказчика и генерального подрядчика
1655;контроль устранения нарушений и дефектов выявленных в процессе проведения предыдущих проверок
1656;анализ результатов проверок объектов нового строительства и оценка их готовности к приемке в эксплуатацию
1657;участие в приемке объектов нового строительства (реконструкции) в эксплуатацию по видам выполненных работ и в комплексной приемке
1658;проверка исполнительной документации представляемой подрядными организациями по видам выполненных работ
1659;оценка возможности подписания актов в том числе акта приемки объекта капитального строительства
1660;осуществление контроля за переводом зданий-новостроек на постоянные источники энергообеспечения (заключение постоянных договоров электро- тепло и водоснабжения между образовательными и ресурсоснабжающими организациями)
1661;совместно с сотрудниками отдела гарантийного сопровождения принимает участие в определении причин появившихся в процессе эксплуатации нарушений и дефектов и их влияния на дальнейшую эксплуатацию новостроек
1662;высшее строительное образование
1663;опыт аналогичной работы не менее 5 лет
1664;опыт монтажа/эксплуатации/разработки слаботочных систем
1665;знание законодательства и иных нормативно-правовых актов регулирующих деятельность в сфере строительства постоянный мониторинг изменений законодательства
1666;опыт работы в системе электронного документооборота
1667;пк на уровне продвинутого пользователя
1668;организация и координация деятельности структурных подразделений компании участвующих в процессе выполнения комплекса работ связанных с созданием нового магазина и организацией его эффективной деятельности
1669;организация и контроль процесса выполнения комплекса работ направленного на подготовку и реализацию проектов по открытию новых объектов розничной торговли
1670;формирование бюджетов проектов по объектам компании и объектам дилеров бюджетов модернизации существующих объектов а также бюджетов закрытий объектов компании
1671;обеспечение соблюдения утвержденных бюджетов
1672;документооборот проектов
1673;высшее техническое образование
1674;опыт работы в рознице ( строительство открытие магазинов розничной торговли)
1675;опыт работы в autocad 3d -как плюс
1676;готовность к командировкам
1677;осуществление контроля за ходом строительства реконструкции объектов нового строительства и их соответствия требованиям технических регламентов утвержденной проектной документации рабочим чертежам строительным нормам применяемыми строительными материалами
1678;фиксирование и оформление нарушений выявленных в результате проведения проверок доведение их до заказчика и генерального подрядчика
1679;контроль устранения нарушений и дефектов выявленных в процессе проведения предыдущих проверок
1680;анализ результатов проверок объектов нового строительства и оценка их готовности к приемке в эксплуатацию
1681;участие в приемке объектов нового строительства (реконструкции) в эксплуатацию по видам выполненных работ и в комплексной приемке
1682;проверка исполнительной документации представляемой подрядными организациями по видам выполненных работ
1683;оценка возможности подписания актов в том числе акта приемки объекта капитального строительства
1684;осуществление контроля за переводом зданий-новостроек на постоянные источники энергообеспечения (заключение постоянных договоров электро- тепло и водоснабжения между образовательными и ресурсоснабжающими организациями)
1685;совместно с сотрудниками отдела гарантийного сопровождения принимает участие в определении причин появившихся в процессе эксплуатации нарушений и дефектов и их влияния на дальнейшую эксплуатацию новостроек
1686;высшее строительное образование
1687;опыт аналогичной работы не менее 5 лет
1688;опыт монтажа/эксплуатации/разработки сантехнических систем
1689;знание законодательства и иных нормативно-правовых актов регулирующих деятельность в сфере строительства постоянный мониторинг изменений законодательства
1690;опыт работы в системе электронного документооборота
1691;пк на уровне продвинутого пользователя
1692;визуально-инструментальное обследование строительных конструкций 
1693;оформление строительных чертежей 
1694;испытания строительных материалов неразрушающими методами с оформлением протоколов 
1695;выполнение поверочных расчетов строительных конструкций 
1696;выполнение отчетов по результатам обследования 
1697;опыт работы необязателен (всему научим расскажем и покажем) 
1698;грамотный пользователь пк (знание программ autocad microsoft word microsoft excel знание scad office приветствуется) 
1699;знание основ проектирования кж км деревянных каменных конструкций 
1700;представление о технологии строительного производства 
1701;умение работать в команде 
1702;желание работать учиться и развиваться 
1703;многозадачность 
1704;возраст – не имеет значения образование – специальное техническое в области проектирования или строительства стаж работы – не менее 2х лет знание языков – русский узбекский владение программами – autocad приветствуется знание – archicad revit 3dmax необходимые навыки – знание и умение пользоваться нормативными документами в области проектирования (кмк снип гост и др) требуемые личностные качества – пунктуальность ответственный подход к работе 
1705;обеспечение выполнения строительных работ
1706;разработка перспективных и текущих планов строительства
1707;координация деятельности подчиненных подразделений постановка задач руководителям проектов
1708;организация работ на строительных объектах
1709;взаимодействие с заказчиками и подрядчиками
1710;разработка и контроль выполнения графиков производства работ
1711;контроль за соблюдением финансовых показателей объектов контроль соблюдения бюджета строительных объектов
1712;организация контроля за соблюдением требований касающихся охраны окружающей среды и безопасности труда
1713;организация технического контроля и надзора за качеством и сроками выполнения строительных работ их соответствие нормам и стандартам
1714;согласование и контроль исполнения ежемесячного бюджета строительных объектов
1715;контроль за своевременным оформлением закрывающих форм и исполнительной документации
1716;анализ и согласование счетов на закупку материалов совместно с отделом снабжения
1717;ведение деловой переписки и участие в переговорах совещаниях с заказчиками и подрядчиками
1718;высшее профессиональное образование в сфере строительства
1719;стаж работы по направлению профессиональной деятельности не менее 5 лет
1720;специальные знания в сфере ведения строительства технология ведения строительных работ
1721;знание законодательных и нормативных правовых актов регулирующих строительную сферу
1722;знание строительных норм и правил порядок разработки и оформления проектно-сметной и другой технической документации правил ведения учета и составления отчетов о деятельности предприятия в области капитального строительства порядок заключения и исполнения хозяйственных и финансовых договоров
1723;знания в области экономики и организации строительного производства труда и управления
1724;свободное владение компьютером знание autocad
1725;умение вести деловые переговоры и деловую переписку
1726;рабочее 2d проектирование в автокад спдс(или nanocad спдс и тп) с постепенным переходом на 3d(bim - archicad/revit и тд) планы разрезы схемы спецификации
1727;встреча клиентов в офисе
1728;офисные обязанности
1729;минимальные требования: знание автокад(спдс) + нормативы
1730;организация ремонта и обслуживания инженерных сетей и коммуникаций 
1731;составление графиков ппр 
1732;ведение тех документации по теплу электроэнергии планово-предупредительным ремонтам 
1733;организация ремонта и надзор за состоянием зданий и сооружений 
1734;взаимодействие с инженерными службами арендодателя 
1735;обеспечение необходимого уровня технической подготовки производства  
1736;обеспечение технической эксплуатации ремонта и модернизации оборудования в том числе швейного разработки и ремонта устройств и приспособлений оптимизирующих производственный процесс 
1737;осуществление контроля соблюдения проектной конструкторской и технологической дисциплины правил и норм по охране труда технике безопасности производственной санитарии и пожарной безопасности 
1738;закупка расходных материалов и запасных частей для производства 
1739;организация проведение испытаний новой техники и технологии 
1740;организация и контроль вывоза мусора сдачи вторсырья 
1741;ежеквартальная проверка измерительного оборудования 
1742;от 5 лет главным инженером  отвечающим за техническую поддержку и работу инженерных систем
1743;опыт работы в сфере производства (преимущество – швейное производство)
1744;владение ms office
1745;общая техническая грамотность
1746;контроль оплаты и сбор дебиторской задолженности
