;Required skill
797;приветствуются навыки работы с графическими редакторами(фотошоп zeplin figma)
798;организация работ по проектам информатизации фсб россии во взаимодействии с начальниками отделов и руководством контроль исполнения задач сроков модель управления—матричная роль рп—координатор работ между отделами
799;взаимодействие с заказчиком с выездом на объекты (крупные объекты пограничной службы фсб россии преимущественно в европейской части россии) проведение совещаний в том числе в фоив проведение презентаций организация сдачи-приемки разрешение спорных ситуаций
800;участие в сборе требований формирование совместно с заказчиком планов по развитию функциональности систем
801;контроль полноты рабочей документации согласование ее с заказчиком в отдельных случаях помощь в ее наполнении
802;администрирование проектов включая формирование планов отчетов протоколов официальная переписка с контрагентами и заказчиком
803;высшее образование в области информационных технологий или техническое
804;опыт администрирования проектов
805;широкий технический кругозор опыт проектирования инфраструктурных решений (цоды) понимание работы сетей представление о инженерных системах (скуд сигнализации системы кондиционирования электросети)
806;опыт участия в проектах по разработке систем в роли ведущего проектировщика/гип и координатора/администратора проектов
807;ясное представление о порядке работы по гост 34ххх знания о принципах работы по гост рв 15ххх будет плюсом
808;грамотная речь хорошие письменные навыки (договоры акты протоколы деловая переписка)
809;хорошие коммуникативные навыки умение договариваться с представителями силовых структур добиваться результата не создавая конфликтов
810;большим плюсом будет опыт работы по проектам фсб россии а также понимание особенностей создания автоматизированных систем в защищенном исполнении
811;представление о современных технических решениях для построения цодов распределенных систем программного обеспечения
812;управление отделом системного анализа (10 человек) 
813;выстраивание внутренних процессов 
814;участие в проектной деятельности presale 
815;управление личным развитием сотрудников подбор новых сотрудников 
816;опыт реализации интеграционных проектов в роли системного аналитика от 5-ти лет 
817;опыт руководства командой от 10 человек 
818;опыт разработки и внедрения внутренних процедур/процессов в системном анализе 
819;опыт работы руководителем отдела анализа будет плюсом 
820;техническая поддержка пользователей (80% рабочего времени)
821;диагностика анализ и решение проблем возникающих с системным или офисным по
822;организация новых рабочих мест: установка настройка администрирование рабочих станций
823;фиксация обращений в service desk 
824;выполнение поручений руководителя в рамках должностных обязанностей 
825;высшее профильное образование (техническое математическое)
826;знание &quotкомпьютерного железа&quot‚ достаточное для диагностики неисправностей‚ замены неисправных комплектующих
827;разработка и реализация единой цифровой стратегии академии
828;разработка и актуализация продуктовых стратегий портфеля цифровых продуктов
829;управление командой администрирования образовательных платформ академии
830;обеспечение администрирования ит продуктов академии ростеха
831;формирование концепции и дальнейшее создание единой базы клиентов/пользователей академии и синхронизации различных продуктов и сервисов по работе с данной базой (crm рассылки по электронной почте и тп)
832;создание концепции и дальнейшее внедрение единой цифровой экосистемы для поддержки и развития сообщества пользователей/клиентов продуктов академии (информационной образовательной коммерческой)
833;самостоятельное ведение проектов по разработке программных продуктов академии
834;взаимодействие с внутренними заказчиками согласование требований к продукту участие в совещаниях
835;управление сроками реализации проектов и приоритетами задач
836;участие в выборе и оценке подрядчиков обсуждение задач с подрядчиками и командой разработки нахождение оптимальных технических решений составление технических заданий
837;управление проектными работами и контроль выполнения работ
838;сопровождение процесса запуска и передачи готовых решений в эксплуатацию
839;помощь в локализации технических и устранении проблем возникающих при эксплуатации продуктов и сервисов
840;анализ трендов по цифровизации проведение исследований опыта цифровой трансформации анализ рынка и внешней среды
841;высшее образование (экономическое техническое)
842;опыт работы в ит-компаниях консалтинговых компаниях аналитических агентствах в подразделениях по цифровизации крупных компаний в области маркетинговых исследований
843;опыт самостоятельного ведения проектов по разработке и внедрению ит продуктов/сервисов
844;опыт внедрения цифровых проектов и решений
845;опыт организации инновационной деятельности в образовательных компаниях желателен
846;опыт участия в разработке ит стратегии
847;системность ориентированность на результат стратегическое видение
848;html5/css3
849;git
850;опыт работы с препроцессорами (sass)
851;знание кроссбраузерной верстки (ie11)
852;знание адаптивной вёрстки
853;опыт работы с графикой (png svg fonts svg)
854;приветствуются навыки работы с графическим редактором figma
855;желателен опыт работы с javascript vue
856;работа с входящей подготовка исходящей документации в рамках работы с ключевым заказчиком
857;сервисная работа с действующими корпоративными клиентами
858;работа в 1с
859;образование не ниже среднего специального желательно высшее
860;уверенный пользователь пк (ms office) желательно 1с
861;знание номенклатуры ит-оборудования будет преимуществом
862;выполнение функций администратора отдела сервисных проектов 
863;инициация и контроль процессов подготовки и оформления документации по проекту (договора дополнительные соглашения спецификации приложения и дополнения к договорам с заказчиками поставщиками и субподрядчиками) в соответствии с бизнес процессами компании 
864;контроль а при необходимости инициация и своевременное создание утверждение внутренних спецификаций по проекту 
865;контролировать ход выполнения проекта своевременно выявлять риски согласовывать и предпринимать необходимые действия для снижения рисков и информировать об этом руководителя и менеджера по продажам 
866;контролировать и обеспечить своевременную передачу в службы компании подписанных заказчиком или поставщиком/субподрядчиком документов (договора акты и тп) по проектам 
867;внесение данных по сервисным проектам в информационные системы компании поддержание информации в актуальном состоянии 
868;заведение заявок на оплату контроль их выполнения оформление и контроль состояния закупок 
869;подготовка и предоставление еженедельных отчетов о статусе проекта и отчетов по запросу 
870;взаимодействие с внутренними службами в рамках исполнения проектов 
871;выполнение распоряжений руководства 
872;владеть навыками работы в ms office электронной почте 
873;иметь общее представление о документообороте 
874;обладать навыками ведения деловой переписки
875;ведение пула ит-проектов
876;подготовка и согласование презентационных материалов
877;составление планов работ ресурсное планирование
878;взаимодействие с подрядчиками
879;подготовка отчетности
880;высшее образование
881;опыт ведения проектов в сфере ит
882;навыки сопровождения ит-систем
883;понимание принципов itil
884;сопровождение рабочих мест
885;техническая поддержка сотрудников компании
886;сопровождение систем видеонаблюдения
887;опыт работы обязателен
888;понимание принципов построения и функционирования локальной вычислительной сети
889;опыт установки и поддержки операционных систем windows
890;понимание устройства и работы ip телефонии
891;знание аппаратной части пк и умение диагностировать и устранять неполадки
892;тестирование web сервиса 
893;описание интерфейсов и функционала 
894;создание тестовой документации 
895;продвинутое владение компьютером 
896;высокая скорость работы 
897;сообразительность аккуратность 
898;поддержка рабочих мест копировально-множительной техники систем акс/вкс
899;консультирование пользователей по телефону электронной почте
900;выявление ошибок на пользовательских компьютерах программного обеспечения восстановление работоспособности системы при сбоях и выходе из строя ит-оборудования
901;подготовка и выдача новых рабочих мест модернизация текущих
902;работа с заявками в системе helpdesk
903;выполнение регламентных sla
904;высшее техническое образование со специализацией в области информационных технологий автоматизированных систем управления системного анализа 
905;обязательно: 
906;знание ос windows и офисного программного обеспечения на уровне опытного пользователя
907;знание основ функционирования и построения лвс
908;навыки диагностики и устранения неисправности пк комплектующих и оргтехники
909;обеспечение функционирования it сервисов компании
910;удаленная поддержка пользователей
911;удаленное устранение инцидентов с it оборудованием в московских офисах компании
912;обучение функционалу по собственной разработки и его последующая поддержка
913;удаленная диагностика и обслуживание оргтехники
914;знание операционных систем семейства windows на уровне продвинутого пользователя
915;навыки установки и настройки операционных систем и приложений
916;знание современных программных продуктов антивирусной защиты
917;готовность к постоянному обучению и самообразованию в процессе работы
918;знание принципов работы сети ethernet и основных сетевых протоколов
919;основы itil
920;опыт работы в omnitracker (желательно)
921;ведение справочника типовых инцидентов
922;опыт написания инструкций технических заданий
923;с помощью описаного алгоритма выполнять ряд действий в фейсбуке для создания официальной рекламыдействия имеют цикличный характер а так же сам алгоритм часто меняется по этому нужно нужно под это подстроится и быстро адаптироваться
924;наличие более-менее мощного ноутбука на windows
925;быстрая обучаемость
926;подключение и настройка периферийного оборудования
927;установка и настройка ос windows ms office клиентского по 
928;устранение неисправностей в работе по и компьютерной техники 
929;консультации пользователей по работе с компьютером и по (около 40 машин)   
930;организация бесперебойной работы пользовательского ит оборудования и доступа работников к корпоративным информационным ресурсам интернету к ресурсам общего доступа
931;настройка рабочих мест работников центрального аппарата включая связь и мфу
932;назначение работникам прав доступа  групповых политик
933;документооборот
934;образование высшее
935;опыт работы от трех лет в сфере администрирования ит систем
936;желателен опыт работы в компаниях с филиальной сетью
937;общая грамотная как устная так и письменная речь
938;навыки ведения документооборота желателен опыт ведения договорной работы с подрядчиками
939;ms word - продвинутый пользователь
940;поддержка пользователей (во всех офисах) – решение проблем с программным обеспечением консультации и пр:  помощь в решении любых проблем связанных с работой программного обеспечения и пк
941;консультации по работе программного обеспечения
942;обслуживание офисной техники: телефоны принтеры сканеры и тд:  контроль наличия всех необходимых расходных материалов
943;организация ремонта (при необходимости)
944;организация прокладки кабельной инфраструктуры(при необходимости непосредственное участие)
945;обслуживание серверной
946;обслуживание всех пк в компании (во всех офисах):  закупка
947;установка и настройка
948;решение любых проблем возникающих в процессе работы
949;мониторинг работы biotime и скуд:  контроль за работой систем
950;решение возникающих проблем
951;ведение документации по выдаваемой технике уз
952;активная помощь в работе ахо (перестановка мебели в офисе осуществление мелкого ремонта)
953;участие в инвентаризациях
954;запись всех публичных мероприятий обработка видео и выкладка на сервер
955;участие в проектах по развитию ит-инфраструктуры
956;выполнения поручений руководителя (системного администратора)
957;курьерские поездки ( по необходимости)
958;знание устройства компьютера
959;опыт не обязателен главное иметь общее представление о работе пк и сетей
960;понимание правильного общения со внутренними клиентаминавык предоставления пользовательского сервиса
961;интерес к ит желание учиться и приобретать опыт
962;порядочность
963;опрятность
964;исполнительность
965;готовность работать на результат
966;умение четко формулировать и излагать мысли
967;возможная работа во внеурочное время в связи с производственной необходимостью
968;обслуживание пк в офисе сетевого оборудования и оргтехники в офисе компании
969;выявление неисправностей компьютерной техники ошибок пользователей и сетевого оборудования
970;установка настройка и обновление по на пк 
971;восстановление работоспособности системы при сбоях и выходе из строя компьютерной техники
972;мелкий ремонт пк и оргтехники
973;помощь пользователям при работе на пк
974;обслуживание как удаленно так и на выезд
975;высшее или среднее специальное техническое образование
976;быстрая обучаемость ответственность пунктуальность инициативность самостоятельность мобильность нацеленность на результат
977;решение проблем пользователей
978;программная и аппаратная диагностика пк и ноутбуков выявление неисправностей
979;настройка и подключение сетевого оборудования
980;установка настройка диагностика oc windows 81 10
981;подключение настройка обслуживание пк периферии оргтехники и программного обеспечения пользователей
982;профильное образование
983;опыт работы от 1 года
984;диагностика и устранение неисправностей арм
985;диагностика и устранение неисправностей оргтехники
986;исполнение поручений руководства в рамках рабочего процесса подразделения
987;высшее (неоконченное) образование
988;базовые знания линейки клиентских операционных систем ms windows
989;уровень знаний необходимый для выполнения задач техподдержки первого уровня
990;решение проблем и консультации пользователей как в московском офисе так и в региональных подразделениях (количество рабочих станций - 130 10 удаленных офисов)
991;подготовка новых рабочих мест
992;диагностика и устранение неисправностей пк и офисной техники
993;взаимодействие с поставщиками компьютерной и офисной техники контроль документооборота
994;высшее/неоконченное высшее профильное образование
995;опыт работы от 1 года по направлению
