;Required skill
2558;организация эффективного взаимодействия с другими подразделениями компании: филиалами складами отделами продаж бухгалтерией 
2559;развитие отдела: - поиск и разработка новых и более выгодных вариантов доставки/ логистики - поиск и согласование более выгодных предложений и цен по закупаемой продукции - анализ складских запасов и предложения по развитию и оптимизации запасов 
2560;организация и стратегическое управление всей закупочной деятельности группы компаний (ит оборудование комплектующие софт сопутствующее оборудование для ит проектов) 
2561;бюджетирование и планирование 
2562;работа с поставщиками в части транспортной и складской логистики с целью экономии и нахождения более рациональных вариантов транспортировки и хранения 
2563;организация процедуры выбора поставщиков на конкурсной основе 
2564;управление работой с поставщиками поддержание отношений с ключевыми поставщиками поиск новых поставщиков и развитие с ними партнерских отношений проведение переговоров в том числе на уровне первых лиц активная деятельность в сфере принятия поставщиками выгодных для компании финансовых и организационных условий работы 
2565;получение лучших цен и сроков поставки увеличение отсрочек платежей поставщиками 
2566;получение спеццен защита проектов предложение альтернативных решений других вендоров 
2567;внедрение программы оптимизации стоимости закупок   
2568;высшее образование
2569;договорная работа (согласование заключение ведение) 
2570;ведение информационной базы данных о заключенных договорах поставки 
2571;взаимодействие с поставщиками с/х техники и оборудования проверка их юридической правоспособности проверка полномочий лиц подписывающих договоры дополнительные соглашения 
2572;обработка первичной документации по перевозкам 
2573;взаимодействие со структурными подразделения общества по согласованию договоров соглашений уведомлений о расторжениях 
2574;участие в разработке локально-нормативных актов 
2575;высшее образование (экономическое юридическое) 
2576;опыт работы с договорами соглашениями актами претензиями 
2577;опытный пользователь пк: офисные программы справочные системы 
2578;аналитический склад ума умение консолидировать большой объем информации 
2579;грамотная устная и письменная речь 
2580;организованность внимательность в работе умение соблюдать сроки 
2581;хорошие коммуникативные навыки 
2582;составление и обновление годового плана закупок
2583;анализ рынка по закупочной категории с целью уточнения требований к продукции или поставщикам и определение потенциальных поставщиков
2584;своевременная подготовка закупочной документации для эффективного обеспечения закупочной деятельности
2585;отчетность по закупкам входящим в зону ответственности
2586;проведение коммерческих переговоров с поставщиками с целью получения наилучших цен и условий поставки
2587;контроль соблюдения условий результатов закупочных процедур путем согласования договоров/дс/заказов) в sap по поручению конкурсных комиссий
2588;высшее образование (предпочтительно экономическое/техническое/финансовое)
2589;анализ рынка по непроизводственным товарам работам услугам (далее - тру) 
2590;проверка документов поступающих от инициаторов закупок непроизводственных тру (ит ахо смр пир консультационные услуги и тд) 
2591;проведение тендеров по направлению непроизводственных тру 
2592;взаимодействие со структурными подразделениями компании по вопросу аккредитации поставщиков 
2593;подготовка документации для проведения тендеров 
2594;ведение реестра аккредитованных поставщиков 
2595;направление приглашений потенциальным участникам тендеров 
2596;поддержание в актуальном состоянии реестра проведенных тендерных процедур 
2597;ведение архива проведенных тендерных процедур 
2598;участие в формировании и реализации категорийных стратегий в области закупок товаров работ и услуг 
2599;организация заседаний тендерного комитета 
2600;высшее образование
2601;опыт работы не менее 5 лет в закупках
2602;владение excel на уровне построения сводных таблиц графиков диаграмм 
2603;подготовка презентаций в powerpoint на уровне продвинутого пользователя 
2604;знание процесса полного цикла закупки от этапа планирования до исполнения договора(контракта) 
2605;знание программ: 1с бд гарант консультант 
2606;осуществление закупки товаров определенного направления: бытовая техника компьютеры картриджи бытовая техника и тд
2607;выбор поставщиков 
2608;заключение договоров 
2609;формирование/ведение/актуализация базы поставщиков
2610;планирование складского запаса 
2611;контроль оптимизация складских остатков (более 1 000 позиций) 
2612;работа по оптимизации затрат улучшению условий поставок увеличению отсрочек платежей 
2613;знание рынка корпоративного обслуживания
2614;знания excel обязательно (сводные таблицы впр)
2615;самоорганизация и оптимизация ежедневных рабочих процессов
2616;мониторинг и аналитика профильных закупок
2617;сбор и подготовка документации
2618;деловая переписка с зарубежными партнерами
2619;ведение переговоров с поставщиками и заказчиками
2620;работа с прочими документами
2621;высшее образование обязательно
2622;умение работать самостоятельно аналитическое мышление умение принимать решение в сложных ситуациях
2623;мониторинг цен на продукты питания: овощи/фрукты замороженная продукция мясо рыба (топ-30) косметика для гостиниц
2624;организация дегустаций составление актов с результатами заведение позиций в программе маркет баскет
2625;направление согласованных заказов поставщикам согласование количества цен сроков и времени доставки
2626;высокие коммуникативные навыки
2627;опыт закупочной деятельности тмц
2628;знание основ ведения договорной работы
2629;любовь к детям и уважение к людям
2630;высшее образование в ревелантных областях
2631;опыт работы в закупках
2632;знание английского языка будет плюсом
2633;доброжелательность профессионализм
2634;выполнение плана закупок
2635;подбор поставщиков
2636;заключение договоров поставки
2637;опыт работы от 1 года
2638;знание 1с:документооборот и excel
2639;контроль рентабельности маржинальной прибыли и оборачиваемости товаров категории
2640;создании ассортиментной матрицы по зоне ответственности анализ ее эффективности
2641;создание ценовой стратегии по зоне ответственности
2642;работа с действующей базой поставщиков и ее расширение
2643;работа над улучшением коммерческих условия по поставщикам
2644;работа с вендорами по увеличению статуса компании
2645;контроль доступности ассортимента на складах компании работа с неликвидным ассортиментом
2646;высшее образование
2647;знание принципов управления товарными категориями (канцтовары)
2648;навык формирования ассортиментной матрицы ценообразования управления товарными запасами
2649;хорошие коммуникативные навыки опыт ведения переговоров с поставщиками
2650;успешный опыт закупок и работы с большим количеством поставщиков
2651;опыт работы в закупках от 2-х лет в торговой компании
2652;умение проектировать ассортиментные матрицы по категориям
2653;понимание спецификации ноутбуковмоноблоков мониторов
2654;знание методов ценообразования
2655;умение работать с розничным и оптовым ассортиментом
2656;знание порядка заключения договоров с поставщиками и контроля за их выполнением
2657;высшее образование и желание обучаться и развиваться в сфере закупок
2658;продвинутый exel пользователь
2659;работа по категориям &quotмобильные аксессуары&quot «товары для спорта» «детские товары» и тд
2660;увеличение прибыли категории в розничном подразделении
2661;планирование заказов продаж остатков и оборачиваемости категории
2662;бюджетирование категории
2663;разработка ассортиментной матрицы выбор новых коллекций
2664;работа по дистрибуции с поставщиками и внутренние закупки на российском рынке
2665;переговоры с поставщиками
2666;развитие розничных продаж по категории
2667;исследование рынка и конкурентной среды
2668;желателен опыт в розничной сети в аналогичных категориях товаров
2669;опыт работы с большими объемами информации
2670;опыт работы с экономическими данными
2671;аналитическое мышление умение определять проблемы и находить их решение
2672;внимательность к деталям умение работать в режиме многозадачности и сжатых сроков
2673;желание и умение работать в команде нацеленность на результат
2674;приветствуется опыт работы в области e-commerce или собственный опыт электронных покупок
2675;отличное знание пк как продвинутый пользователь 1с
2676;ведение и комплектация заявок
2677;подготовка заключения договоров с поставщиками согласование условий и сроков поставок
2678;контроль доставки товара в соответствии с предусмотренными в договорах сроками
2679;работа в 1с 83 приход товара ведение остатков в 1с
2680;опыт работы в закупках (с количеством sku от 50 тысяч) не менее 1 года
2681;знание ассортимента компьютерной техники обязательно
2682;хорошее знание excel
2683;умение работать с большими объемами информации
2684;организация и проведение электронных государственных закупок
2685;составляет и утверждает годовой план государственных закупок
2686;высшее (экономическое и юридическое) образование стаж не менее 3 лет по соответствующей специальности
2687;своевременное обеспечение оборудованием и запасными частями по заказам
2688;осуществление поиска поставщиков ориентируясь на качество цену и сроки поставки
2689;заключение договоров / спецификаций с поставщиками
2690;формирование и отслеживание своевременной оплаты поставщикам и транспортные услуги
2691;организация процесса доставки оборудования и запасных частей от поставщиков до клиентов
2692;контроль за дебиторской и кредиторской задолженностью по закрепленным поставщикам
2693;анализ и контроль за оптимальным количеством остатков на складах
2694;опыт работы в сфере снабжения в сегменте horeca
2695;знание 1с торговля
2696;знание основ по организации закупок и логистики поставок
2697;навык общения с контрагентами по вопросам поставок
2698;умение разбираться в чертежах торгового оборудования приветствуется
2699;работа с прайсами поиск оборудования по модели подстановка цен в форму
2700;работа с техническим заданием подбор оборудования по указанным характеристикам
2701;работа с яндексмаркет
2702;техническое мышление умение соотносить смежные характеристики оборудования
2703;базовые знания в электротехнике и электронике компьютерном оборудовании системах видеонаблюдения
2704;базовые знания охранно-пожарного оборудования либо желание приобрести эти знания
2705;доступность в рабочее время (1000-1900 по мск) на телефоне и в мессенджерах (вотсап вайбер)
2706;обязательное соблюдение сроков исполнения ежедневной нормы в день нужно подобрать 75 товарных позиций это требует не более 8-9 часов работы те полноценный рабочий день
2707;обеспечение производства материалами и комплектующими обеспечение вспомогательных служб
2708;обработка заявок на закупку планирование доставок планирование бюджета по своему направлению
2709;расчет объема заказов размещение заказов поставщикам по установленным календарным графикам
2710;контроль сроков поставки сроков годности и нормативов логистического цикла в разрезе sku
2711;умение провести анализ рынка на предмет продуктов предложений и возможностей конкурентов для поддержания нашей конкурентоспособности
2712;контроль за связанными с продуктом расходами (капитальные и операционные) и их влияние на конкурентоспособность
2713;активная работа с внутренними заказчика (смежные подразделения)
2714;умение делать презентации по продуктовым линейкам новым продуктам
2715;поиск поставщиков ведение переговоров с поставщиками
2716;работа с большими базами данных (цены условия движение товара)
2717;переговоры с поставщиками с целью улучшения ценовых и кредитных условий
2718;поиск возможных аналогов заказанных позиций согласование технических характеристик
2719;работа по снижению затрат на закупки
2720;контроль соблюдения условий договора своевременных отгрузок
2721;планирование поступлений товаров на склады ввод данных в учетную систему (1c)
2722;работа с оплатами дебиторской и кредиторской задолженностью
2723;формирование сводной отчетности
2724;ведение деловой переписки
2725;работа с документами в excel – таблицы реестры графики
2726;работа в 1с
2727;контроль складских запасов
2728;высшее профессиональное (техническое инженерно-экономическое) образование
2729;уверенная работа в erp желательно знание 1с
2730;опыт работы от 2-х лет в инженерном или продуктовом направлении на it рынке
2731;обязателен опыт работы с серверным оборудованием мировых лидеров
2732;уверенная работа в ms office
2733;ведение переговоров внимательность стрессоустойчивость
2734;работоспособность аккуратность честность
2735;знание серверного оборудования и схд
2736;работа с существующим ассортиментом товаров (общее кол-во sku более 2 000)
2737;опыт работы с производителями дистрибьюторами
2738;умение работать в команде
2739;знание английского на уровне чтения технической литературы
2740;глубокие знания мирового рынка компьютерного оборудования – основные игроки и их продукты технологии и тенденции в ит техническое устройство современных вычислительных устройств
2741;консультирование клиентов и партнёров по входящим звонкам/эл почте по общим и техническим вопросам
2742;помощь в ведении документооборота с партнёрами
2743;логистика (приём отправлений создание новых контроль и отслеживание)
2744;организация и поддержка комфортной работы офиса (закупка канцелярии расходников)
2745;информирование клиентов о новостях сервисного центра (работа с социальными сетями создание кратких объявлений)
2746;любовь к технике apple
2747;любовь к людям
2748;готовность к активному обучению
2749;умение объяснить простое просто а сложное — тоже просто
2750;ответственность и педантичность
2751;осуществление прямых закупок и заключение контрактов договоров проведение переговоров с поставщиками
2752;контроль выполнения функциональных обязанностей при планировании закупок обосновании закупок обосновании нмцк(д)
2753;ведение реестра проведенных закупок и заключенных контрактов
2754;контроль исполнения контрактов
2755;подготовка и согласование проектов технических заданий проектов договоров иных документов относящихся к закупочной деятельности (в рамках своей компетенции) разработка положений и регламентов о закупках об отделе осуществление иных полномочия и распоряжений руководства
2756;решение различных административно-хозяйственных вопросов (в подчинении специалист ахо)
2757;образование высшее юридическое экономическое
2758;хорошие знания ms office (excel высокий уровень)
2759;умение вести переговоры
